<?xml version="1.0" encoding="UTF-8"?>
<PKIEntities xmlns:xsi="http://www.w3.org/2001/XMLSchema-instance"
	xsi:noNamespaceSchemaLocation="EntitiesSchema.xsd">
	<CA-Entities>
		<CAEntity Name="ENM PKI Root CA">
			<Subject>
				<SubjectDN>
					<SubjectEntry>
						<Type>COMMON_NAME</Type>
						<Value>ENM PKI Root CA</Value>
					</SubjectEntry>
				</SubjectDN>
			</Subject>
			
			<EntityProfileName>ENM PKI Root CA EP</EntityProfileName>
						
			<PublishCertificatetoTDPS>true</PublishCertificatetoTDPS>
			
			<RootCA>true</RootCA>
				
			<CACRL>
				<PublishCRLToCDPS>true</PublishCRLToCDPS>
				<CRLGenerationInfo>
				<Version>V2</Version>
				<SignatureAlgorithm>
					<Name>SHA256withRSA</Name>
					<KeySize>2048</KeySize>
				</SignatureAlgorithm>
				<ValidityPeriod>P30D</ValidityPeriod>
				<SkewCrlTime>PT30M</SkewCrlTime>
				<OverlapPeriod>P1D</OverlapPeriod>
				<CrlExtensions>
					<CRLNumber>
						<Critical>false</Critical>
					</CRLNumber>
					<AuthorityKeyIdentifier>
						<Critical>false</Critical>
						<ByAuthorityCertIssuerAndSerialNumber>true</ByAuthorityCertIssuerAndSerialNumber>
					</AuthorityKeyIdentifier>
				</CrlExtensions>
				</CRLGenerationInfo>
			</CACRL>
		</CAEntity>
	</CA-Entities>
</PKIEntities>





