<?xml version="1.0" encoding="UTF-8"?>
<PKIEntities xmlns:xsi="http://www.w3.org/2001/XMLSchema-instance"
	xsi:noNamespaceSchemaLocation="EntitiesSchema.xsd">
	<CA-Entities>
	

		<CAEntity Name="DEMO_NE_IPsec_CA">
			<Subject>
				<SubjectDN>
					<SubjectEntry>
						<Type>COMMON_NAME</Type>
						<Value>DEMO_NE_IPsec_CA</Value>
					</SubjectEntry>
				</SubjectDN>
			</Subject>
			
			<EntityProfileName>DEMO_NE_CA_EP</EntityProfileName>
			<KeyGenerationAlgorithm>
				<Name>RSA</Name>
				<KeySize>2048</KeySize>
			</KeyGenerationAlgorithm>			
			<PublishCertificatetoTDPS>true</PublishCertificatetoTDPS>
			
			<RootCA>false</RootCA>
				
			<CACRL>
				<PublishCRLToCDPS>true</PublishCRLToCDPS>
				<CRLGenerationInfo>
				<Version>V2</Version>
				<SignatureAlgorithm>
					<Name>SHA256withRSA</Name>
					<KeySize>2048</KeySize>
				</SignatureAlgorithm>
				<ValidityPeriod>P30D</ValidityPeriod>
				<SkewCrlTime>PT15M</SkewCrlTime>
				<OverlapPeriod>P1D</OverlapPeriod>
				<CrlExtensions>
					<CRLNumber>
						<Critical>false</Critical>
					</CRLNumber>
					<AuthorityKeyIdentifier>
						<Critical>false</Critical>
						<ByAuthorityCertIssuerAndSerialNumber>true</ByAuthorityCertIssuerAndSerialNumber>
					</AuthorityKeyIdentifier>
				</CrlExtensions>
				</CRLGenerationInfo>		
			</CACRL>
			
		</CAEntity>

		<CAEntity Name="DEMO_NE_OAM_CA">
			<Subject>
				<SubjectDN>
					<SubjectEntry>
						<Type>COMMON_NAME</Type>
						<Value>DEMO_NE_OAM_CA</Value>
					</SubjectEntry>
				</SubjectDN>
			</Subject>
			
			<EntityProfileName>DEMO_NE_CA_EP</EntityProfileName>
			<KeyGenerationAlgorithm>
				<Name>RSA</Name>
				<KeySize>2048</KeySize>
			</KeyGenerationAlgorithm>			
			<PublishCertificatetoTDPS>true</PublishCertificatetoTDPS>
			
			<RootCA>false</RootCA>
				
			<CACRL>
				<PublishCRLToCDPS>true</PublishCRLToCDPS>
				<CRLGenerationInfo>
				<Version>V2</Version>
				<SignatureAlgorithm>
					<Name>SHA256withRSA</Name>
					<KeySize>2048</KeySize>
				</SignatureAlgorithm>
				<ValidityPeriod>P30D</ValidityPeriod>
				<SkewCrlTime>PT15M</SkewCrlTime>
				<OverlapPeriod>P1D</OverlapPeriod>
				<CrlExtensions>
					<CRLNumber>
						<Critical>false</Critical>
					</CRLNumber>
					<AuthorityKeyIdentifier>
						<Critical>false</Critical>
						<ByAuthorityCertIssuerAndSerialNumber>true</ByAuthorityCertIssuerAndSerialNumber>
					</AuthorityKeyIdentifier>
				</CrlExtensions>
				</CRLGenerationInfo>		
			</CACRL>

		</CAEntity>				

		<CAEntity Name="DEMO_OAM_CA">
			<Subject>
				<SubjectDN>
					<SubjectEntry>
						<Type>COMMON_NAME</Type>
						<Value>DEMO_OAM_CA</Value>
					</SubjectEntry>
				</SubjectDN>
			</Subject>
			
			<EntityProfileName>DEMO_System_CA_EP</EntityProfileName>
			<KeyGenerationAlgorithm>
				<Name>RSA</Name>
				<KeySize>2048</KeySize>
			</KeyGenerationAlgorithm>			
			<PublishCertificatetoTDPS>true</PublishCertificatetoTDPS>
			
			<RootCA>false</RootCA>
				
			<CACRL>
				<PublishCRLToCDPS>true</PublishCRLToCDPS>
				<CRLGenerationInfo>
				<Version>V2</Version>
				<SignatureAlgorithm>
					<Name>SHA256withRSA</Name>
					<KeySize>2048</KeySize>
				</SignatureAlgorithm>
				<ValidityPeriod>P30D</ValidityPeriod>
				<SkewCrlTime>PT15M</SkewCrlTime>
				<OverlapPeriod>P1D</OverlapPeriod>
				<CrlExtensions>
					<CRLNumber>
						<Critical>false</Critical>
					</CRLNumber>
					<AuthorityKeyIdentifier>
						<Critical>false</Critical>
						<ByAuthorityCertIssuerAndSerialNumber>true</ByAuthorityCertIssuerAndSerialNumber>
					</AuthorityKeyIdentifier>
				</CrlExtensions>				
				</CRLGenerationInfo>		
			</CACRL>
			
		</CAEntity>	
		<CAEntity Name="DEMO_Management_CA">
			<Subject>
				<SubjectDN>
					<SubjectEntry>
						<Type>COMMON_NAME</Type>
						<Value>DEMO_Management_CA</Value>
					</SubjectEntry>
				</SubjectDN>
			</Subject>
			
			<EntityProfileName>DEMO_System_CA_EP</EntityProfileName>
			<KeyGenerationAlgorithm>
				<Name>RSA</Name>
				<KeySize>2048</KeySize>
			</KeyGenerationAlgorithm>						
			<PublishCertificatetoTDPS>true</PublishCertificatetoTDPS>
			
			<RootCA>false</RootCA>
				
			<CACRL>
				<PublishCRLToCDPS>true</PublishCRLToCDPS>
				<CRLGenerationInfo>
				<Version>V2</Version>
				<SignatureAlgorithm>
					<Name>SHA256withRSA</Name>
					<KeySize>2048</KeySize>
				</SignatureAlgorithm>
				<ValidityPeriod>P30D</ValidityPeriod>
				<SkewCrlTime>PT15M</SkewCrlTime>
				<OverlapPeriod>P1D</OverlapPeriod>
				<CrlExtensions>
					<CRLNumber>
						<Critical>false</Critical>
					</CRLNumber>
					<AuthorityKeyIdentifier>
						<Critical>false</Critical>
						<ByAuthorityCertIssuerAndSerialNumber>true</ByAuthorityCertIssuerAndSerialNumber>
					</AuthorityKeyIdentifier>
				</CrlExtensions>
				</CRLGenerationInfo>		
			</CACRL>
			
		</CAEntity>	

		<CAEntity Name="DEMO_NBI_CA">
			<Subject>
				<SubjectDN>
					<SubjectEntry>
						<Type>COMMON_NAME</Type>
						<Value>DEMO_NBI_CA</Value>
					</SubjectEntry>
				</SubjectDN>
			</Subject>
			
			<EntityProfileName>DEMO_System_CA_EP</EntityProfileName>
			<KeyGenerationAlgorithm>
				<Name>RSA</Name>
				<KeySize>2048</KeySize>
			</KeyGenerationAlgorithm>						
			<PublishCertificatetoTDPS>true</PublishCertificatetoTDPS>
			
			<RootCA>false</RootCA>
				
			<CACRL>
				<PublishCRLToCDPS>true</PublishCRLToCDPS>
				<CRLGenerationInfo>
				<Version>V2</Version>
				<SignatureAlgorithm>
					<Name>SHA256withRSA</Name>
					<KeySize>2048</KeySize>
				</SignatureAlgorithm>
				<ValidityPeriod>P30D</ValidityPeriod>
				<SkewCrlTime>PT15M</SkewCrlTime>
				<OverlapPeriod>P1D</OverlapPeriod>
				<CrlExtensions>
					<CRLNumber>
						<Critical>false</Critical>
					</CRLNumber>
					<AuthorityKeyIdentifier>
						<Critical>false</Critical>
						<ByAuthorityCertIssuerAndSerialNumber>true</ByAuthorityCertIssuerAndSerialNumber>
					</AuthorityKeyIdentifier>
				</CrlExtensions>
				</CRLGenerationInfo>		
			</CACRL>
			
		</CAEntity>											
		
	</CA-Entities>
	
</PKIEntities>
